### ISSUE TITLE
Интервал не работает с ходу

### ISSUE THREAD

**Issue by u666sa** [ilya-fedin/hilink-tray#4]
Можно прогу запустить без аргументов или с аргументами, разницы нет. Я запускаю так -- /home/alex/.Applications/HiLink_Tray-x86_64.AppImage -ip 172.16.16.1 -i 10
ну можно и так -- /home/alex/.Applications/HiLink_Tray-x86_64.AppImage -ip 172.16.16.1

Прога будет полить IP чуть ли не каждые пол секунды, проверял с помощью Wireshark. 

Right кликаю на иконту и иду в Settings.  Там видно что интервал был поставлен 10, кликаю на OK, и всё теперь нормально будет полить каждые 10 секунд.

Так что баг, прога при первом запуске полит IP каждые пол секунды и ей по фиг на interval.. Пробовал скомпильнуть, там не алё, уже не помпю почему. Вот output из Wireshark когда прога так себя ведёт. Обратите внимание на время, LoL

`No.     Time           Source                Destination           Protocol Length Info
   1338 13.670067072   172.16.0.88           172.16.16.1           TCP      66     53330 → 80 [ACK] Seq=315 Ack=315 Win=64128 Len=0 TSval=3436402507 TSecr=1151744

Frame 1338: 66 bytes on wire (528 bits), 66 bytes captured (528 bits) on interface 0
Ethernet II, Src: Azurewav_5f:c0:b0 (00:15:af:5f:c0:b0), Dst: ZyxelCom_06:55:c8 (ec:43:f6:06:55:c8)
Internet Protocol Version 4, Src: 172.16.0.88, Dst: 172.16.16.1
Transmission Control Protocol, Src Port: 53330, Dst Port: 80, Seq: 315, Ack: 315, Len: 0

No.     Time           Source                Destination           Protocol Length Info
   1339 13.670114445   172.16.16.1           172.16.0.88           HTTP/XML 1155   HTTP/1.1 200 OK 

Frame 1339: 1155 bytes on wire (9240 bits), 1155 bytes captured (9240 bits) on interface 0
Ethernet II, Src: ZyxelCom_06:55:c8 (ec:43:f6:06:55:c8), Dst: Azurewav_5f:c0:b0 (00:15:af:5f:c0:b0)
Internet Protocol Version 4, Src: 172.16.16.1, Dst: 172.16.0.88
Transmission Control Protocol, Src Port: 80, Dst Port: 53330, Seq: 315, Ack: 315, Len: 1089
[2 Reassembled TCP Segments (1403 bytes): #1337(314), #1339(1089)]
Hypertext Transfer Protocol
eXtensible Markup Language

No.     Time           Source                Destination           Protocol Length Info
   1340 13.670127735   172.16.0.88           172.16.16.1           TCP      66     53330 → 80 [ACK] Seq=315 Ack=1404 Win=64128 Len=0 TSval=3436402507 TSecr=1151744

Frame 1340: 66 bytes on wire (528 bits), 66 bytes captured (528 bits) on interface 0
Ethernet II, Src: Azurewav_5f:c0:b0 (00:15:af:5f:c0:b0), Dst: ZyxelCom_06:55:c8 (ec:43:f6:06:55:c8)
Internet Protocol Version 4, Src: 172.16.0.88, Dst: 172.16.16.1
Transmission Control Protocol, Src Port: 53330, Dst Port: 80, Seq: 315, Ack: 1404, Len: 0

No.     Time           Source                Destination           Protocol Length Info
   1341 13.670137585   172.16.16.1           172.16.0.88           TCP      66     80 → 53330 [FIN, ACK] Seq=1404 Ack=315 Win=15552 Len=0 TSval=1151744 TSecr=3436402487

Frame 1341: 66 bytes on wire (528 bits), 66 bytes captured (528 bits) on interface 0
Ethernet II, Src: ZyxelCom_06:55:c8 (ec:43:f6:06:55:c8), Dst: Azurewav_5f:c0:b0 (00:15:af:5f:c0:b0)
Internet Protocol Version 4, Src: 172.16.16.1, Dst: 172.16.0.88
Transmission Control Protocol, Src Port: 80, Dst Port: 53330, Seq: 1404, Ack: 315, Len: 0

No.     Time           Source                Destination           Protocol Length Info
   1342 13.670650121   172.16.0.88           172.16.16.1           TCP      66     53330 → 80 [FIN, ACK] Seq=315 Ack=1405 Win=64128 Len=0 TSval=3436402507 TSecr=1151744

Frame 1342: 66 bytes on wire (528 bits), 66 bytes captured (528 bits) on interface 0
Ethernet II, Src: Azurewav_5f:c0:b0 (00:15:af:5f:c0:b0), Dst: ZyxelCom_06:55:c8 (ec:43:f6:06:55:c8)
Internet Protocol Version 4, Src: 172.16.0.88, Dst: 172.16.16.1
Transmission Control Protocol, Src Port: 53330, Dst Port: 80, Seq: 315, Ack: 1405, Len: 0

No.     Time           Source                Destination           Protocol Length Info
   1343 13.672107407   172.16.0.88           172.16.16.1           TCP      74     53332 → 80 [SYN] Seq=0 Win=64240 Len=0 MSS=1460 SACK_PERM=1 TSval=3436402509 TSecr=0 WS=128

Frame 1343: 74 bytes on wire (592 bits), 74 bytes captured (592 bits) on interface 0
Ethernet II, Src: Azurewav_5f:c0:b0 (00:15:af:5f:c0:b0), Dst: ZyxelCom_06:55:c8 (ec:43:f6:06:55:c8)
Internet Protocol Version 4, Src: 172.16.0.88, Dst: 172.16.16.1
Transmission Control Protocol, Src Port: 53332, Dst Port: 80, Seq: 0, Len: 0
[file.txt](https://github.com/ilya-fedin/hilink-tray/files/3948738/file.txt)
`

**Comment by ilya-fedin** [comment]
У меня в разработке уже где-то с весны или даже год новая версия на Go и Qt 5. Я что-то на неё подзабил, когда произошел затык с gomodules - биндинги культей упорно не хотели с ними работать. Прошло уже много времени, наверняка этодело пофиксили - надо будет глянуть.

**Comment by u666sa** [comment]
Ok.  Для фикса отредактируй tray.py

    def setup(self, ip, interval):
        self._monitorThread = QtCore.QThread()
        self._modem = Modem(ip, interval)
        self._modem.moveToThread(self._monitorThread)

        self._modem.finished.connect(self._monitorThread.quit)
        self._monitorThread.finished.connect(self.quit)
        self._monitorThread.started.connect(self._modem.monitor)

        self._trayIndicator = ModemIndicator(self._modem)
        self._modem.levelChanged.connect(
            self._trayIndicator.signalLevelChanged, QtCore.Qt.QueuedConnection)
        self._modem.statusChanged.connect(
            self._trayIndicator.statusChanged, QtCore.Qt.QueuedConnection)
        self._modem.signalParamsChanged.connect(
            self._trayIndicator.signalParamsChanged, QtCore.Qt.QueuedConnection)
        self._modem.unreadMessagesCountChanged.connect(
            self._trayIndicator.needNotify, QtCore.Qt.QueuedConnection)
        **self._modem.setInterval(interval)**
